A47F0001120000;dispensing from the side of an approximately horizontal stack
A47F0001140000;Containers adapted to stacking or to be combined with, or combined to form, a stand
A47F0001160000;Containers characterised by being rotatable
A47F0001180000;Combinations of racks and shop vending jars
A47F0003000000;Showcases or show cabinets
A47F0003020000;with dispensing arrangements (coin-freed G07F)
A47F0003022000;dispensing from top
A47F0003024000;dispensing from bottom
A47F0003026000;having mechanical dispensing means
A47F0003040000;air-conditioned, refrigerated (refrigerators F25D. heating arrangements specially adapted for transparent or reflecting areas H05B0003840000)
A47F0003060000;with movable or removable shelves
A47F0003080000;with arrangements for continuously or intermittently moving the merchandise
A47F0003100000;Rotary showcases or show cabinets
A47F0003110000;having mechanical drive
A47F0003120000;Clamps or other devices for supporting, fastening, or connecting glass plates
A47F0003140000;Display trays (packing boxes used subsequently as display trays B65D)
A47F0005000000;Show stands, hangers, or shelves characterised by their constructional features
A47F0005010000;made of tubes or wire (foldable or adjustable A47F0005130000)
A47F0005020000;Rotary display stands
A47F0005025000;having mechanical drive, e.g. turntables (A47F0005030000 takes precedence)..
A47F0005030000;with horizontal rotation axis
A47F0005040000;Stands with a central pillar, e.g. tree type
A47F0005050000;with separate containers rotatable around the pillar
A47F0005060000;adjustable
A47F0005080000;secured to the wall, ceiling, or the like. Wall-bracket display devices
A47F0005100000;Adjustable or foldable display stands
A47F0005110000;made of cardboard, paper, or the like (A47F0005120000 takes precedence)..
A47F0005120000;Tiltable stands
A47F0005130000;made of tubes or wire (A47F0005120000 takes precedence)..
A47F0005140000;Tubular connecting elements for wire stands
A47F0005160000;Platform type show stands with flat, inclined, or curved upper surface
A47F0007000000;Show stands, hangers, or shelves, adapted for particular articles or materials
A47F0007020000;for jewellery, dentures, watches, eye-glasses, lenses, or the like
A47F0007024000;with provisions for preventing unauthorised removal
A47F0007030000;of box shape. Adaptations of boxes to display purposes
A47F0007040000;for tyres. for wheels
A47F0007060000;for hats
A47F0007080000;for shoes
A47F0007100000;for hosiery
A47F0007120000;for ties (household necktie holders A47G0025740000). for collars
A47F0007140000;for pictures, e.g. in combination with books or seed-bags
A47F0007160000;for carpets. for wallpaper. for textile materials
A47F0007170000;in rolls or rolled tapes
A47F0007180000;for clothing materials (A47F0007170000 takes precedence)..
A47F0007190000;for garments (for hosiery A47F0007100000. for ties or collars A47F0007120000. dummies, busts, or the like A47F0008000000. wardrobes with garment-holders A47B0061000000. household implements used in connection with wearing apparel or dress holders A47G0025000000)
A47F0007220000;for shirts
A47F0007240000;Clothes racks
A47F0007260000;extensible from a showcase
A47F0007280000;for containers, e.g. flasks, bottles
A47F0007300000;for furniture, e.g. beds, mattresses
A47F0008000000;Dummies, busts, or the like, e.g. for displaying garments (tailors' dummies A41H0005000000)
A47F0008020000;Wire figures. Contour figures for displaying garments
A47F0009000000;Shop, bar, bank or like counters (showcases or show cabinets A47F0003000000. safety transaction partitions, e.g. movable pay plates, E05G0007000000)
A47F0009020000;Paying counters
A47F0009040000;Check-out counters, e.g. for self-service stores
A47F0010000000;Furniture or installations specially adapted to particular types of service systems, not otherwise provided for (conveyor aspects B65G. building aspects E04H. coin-freed apparatus G07F)
A47F0010020000;for self-service type systems, e.g. supermarkets (A47F0010060000 takes precedence.hand-carts B62B. baskets B65D)
A47F0010040000;for storing or handling self-service hand-carts or baskets
A47F0010060000;for restaurant service systems (table equipment A47G)
A47F0011000000;Arrangements in shop windows or showcases
A47F0011020000;Removable walls. Pillars. Special curtains or the like
A47F0011040000;Special arrangements of mirrors or the like
A47F0011060000;Means for bringing about special optical effects
A47F0011080000;Non-reflecting shop-windows
A47F0011100000;Arrangements of light sources
A47F0013000000;Shop or like accessories (devices for drawing-off and cutting paper from a roll B65H. movably-mounted ladders E06C0009060000)
A47F0013040000;Twine holders or cutters
A47F0013060000;Reaching devices (having gripping means B25J)
A47F0013080000;Hand implements, e.g. grocers' scoops, ladles, paper-bag holders
A47G;HOUSEHOLD OR TABLE EQUIPMENT (book-ends A47B0065000000. knives B26B)
A47G0001000000;Mirrors (hand, pocket, or shaving mirrors A45D0042000000. as optical elements G02B0005080000). Picture frames or the like
A47G0001020000;Mirrors used as equipment
A47G0001040000;Multi-part mirrors
A47G0001060000;Picture frames (making from paper B31D)
A47G0001080000;adjustable
A47G0001100000;Corner clips or corner-connecting appliances for frames
A47G0001120000;Frames or housings for storing medals, badges, or the like
A47G0001140000;Photograph stands
A47G0001160000;Devices for hanging or supporting pictures, mirrors, or the like
A47G0001170000;using adhesives, suction or magnetism
A47G0001180000;Picture loops or the like
A47G0001200000;Picture hooks. X-hooks (plugs or hooks for general use F16B0013000000, F16B0045000000)
A47G0001210000;with clamping action (in general F16B0002000000)
A47G0001220000;Pin plates
A47G0001240000;Appliances for adjusting pictures, mirrors, or the like, into a desired position, especially inclined
A47G0003000000;Removable ornamental heads for nails, screws, or the like (specially shaped, non-removable heads for nails F16B0015020000, for screws F16B0023000000)
A47G0005000000;Screens (shower screens A47K0003300000. shutters closing an opening E06B0009020000. fly-screens E06B0009520000). Draught-deflectors
A47G0005020000;Roll-up screens
A47G0005040000;Fire screens
A47G0007000000;Flower holders or the like (flower holders worn on garments A45F0005080000)
A47G0007020000;Devices for supporting flower-pots or cut flowers (flower-pots, holders for flower-pots in greenhouses A01G)
A47G0007030000;Needle cushions or needle plates for supporting flowers in pots or vases
A47G0007040000;Flower tables. Stands or hangers, e.g. baskets, for flowers (stands for use during growing of flowers A01G)
A47G0007060000;Flower vases
A47G0007070000;Guiding means for flowers in vases, e.g. perforated covers
A47G0007080000;Covers for flower-pots
A47G0009000000;Bed-covers. Counterpanes. Travelling rugs. Sleeping rugs. Sleeping bags. Pillows (pillows specially adapted for preventing snoring A61F0005560000)
A47G0009020000;Bed linen. Blankets. Counterpanes (sheets specially adapted for use as or with stretchers for patients or invalids A61G0001010000)
A47G0009040000;with fastening strips (haberdashery in general A44B)
A47G0009060000;Travelling rugs. Sleeping rugs
A47G0009080000;Sleeping bags
A47G0009100000;Pillows (pillow holders A47C0021000000)
A47G0011000000;Table linen
A47G0019000000;Table devices or equipment
A47G0019000000;Table service
A47G0019020000;Plates, dishes or the like
A47G0019030000;for using only once, e.g. made of paper
A47G0019040000;Plates with detachable waste receptacles
A47G0019060000;Plates with integral holders for spoons, glasses, or the like
A47G0019080000;Plate-holders (holders for kitchen pots A47J0045100000)
A47G0019100000;Devices for securing plates to the table
A47G0019120000;Vessels or pots for table use
A47G0019140000;Coffee or tea pots (filters, strainers A47J0031060000)
A47G0019160000;Tea infusers, e.g. infusing bags, egg-shaped infusers (for using only once, e.g. made of paper, B65D, e.g. disposable containers or packages B65D0085804000)
A47G0019180000;Containers for delivering jam, mustard, or the like (soap deliverers A47K0005060000)
A47G0019200000;Tea or coffee pot cosies
A47G0019220000;Drinking vessels or saucers used for table service (glass or drinking-vessel underlays A47G0023030000)
A47G0019230000;of stackable type
A47G0019240000;Shakers for salt, pepper, sugar, or the like
A47G0019260000;Butter or cheese dishes or covers, with or without cooling or heating devices. Protective covers for food containers
A47G0019280000;Egg-cups. Openers for boiled eggs (egg-openers as domestic appliances A47J0043140000)
A47G0019300000;Other containers or devices used as table equipment
A47G0019320000;Food containers with dispensing devices for bread, rolls, sugar, or the like. Food containers with movable covers (used as shop fittings A47F)
A47G0019340000;dispensing a certain quantity of powdered or granulated foodstuffs, e.g. sugar
A47G0021000000;Table-ware (crumb trays A47L0013520000. table knives B26B)
A47G0021020000;Forks. Forks with ejectors. Combined forks and spoons. Salad servers
A47G0021040000;Spoons. Pastry servers
A47G0021060000;Combined or separable sets of table-service utensils. Oyster knives with openers. Fish servers with means for removing bones (kitchen equipment A47J)
A47G0021080000;Serving devices for one-handed persons
A47G0021100000;Sugar tongs. Asparagus tongs. Other food tongs
A47G0021120000;Toothpick holders
A47G0021140000;Knife racks or stands. Holders for table utensils attachable to plates
A47G0021160000;Table-cloth or napkin holders
A47G0021180000;Drinking straws or the like (for therapeutic purposes A61J0015000000)
A47G0023000000;Other table equipment
A47G0023020000;Glass or bottle holders
A47G0023030000;Underlays for glasses or drinking-vessels
A47G0023032000;made of paper, board, or the like, e.g. beermats
A47G0023040000;Containers with means for keeping food cool or hot (for butter or cheese A47G0019260000)
A47G0023060000;Serving trays (service tables A47B0031000000)
A47G0023080000;Food-conveying devices for tables. Movable or rotary food-serving devices
A47G0023100000;Devices for counting or marking the number of consumptions (on beverage-dispensing apparatus B65D, B67D. counting in general G06M)
A47G0023120000;Consumption counters combined with table-ware
A47G0023140000;combined with underlays, e.g. for glasses
A47G0023160000;combined with drinking vessels or with lids therefor
A47G0025000000;Dwelling equipment
A47G0025000000;Household implements used in connection with wearing apparel. Dress, hat or umbrella holders (wardrobes A47B0061000000)
A47G0025020000;Dress holders. Dress suspending devices. Clothes-hanger assemblies. Clothing lifters (clothing or suit hangers A47G0025140000. clothing holders with locking devices E05B0069000000)
A47G0025060000;Clothes hooks. Clothes racks. Garment-supporting stands with swingable or extending arms (with lockable hooks E05B0069020000)
A47G0025080000;Portable pocket clothes-holders attachable to trees, walls, tables, or the like
A47G0025100000;Hat holders. Hat racks
A47G0025120000;Cane or umbrella stands or holders
A47G0025140000;Clothing hangers, e.g. suit hangers (A47G0025600000 takes precedence.wardrobes with extensible garment holders A47B0061020000)
A47G0025160000;for complete outfits (A47G0025400000, A47G0025440000 take precedence)..
A47G0025180000;for two or more similar garments, e.g. constructed to connect to, or support, a similar hanger
A47G0025200000;with devices for preserving the shape of the clothes
A47G0025220000;specially adapted for furs
A47G0025240000;made of wire (A47G0025420000, A47G0025460000, A47G0025520000, A47G0025640000, A47G0025700000 take precedence)..
A47G0025260000;specially adapted to prevent slipping-off of the clothes. e.g. with non-slip surfaces (A47G0025300000 takes precedence)..
A47G0025280000;Hangers characterised by their shape
A47G0025300000;to prevent slipping-off of the clothes
A47G0025320000;involving details of the hook (A47G0025340000, A47G0025380000 take precedence)..
A47G0025340000;with hook and hanger made in one piece (A47G0025360000 takes precedence)..
A47G0025360000;characterised by the selection of the material, e.g. paper, board, plastics, glass
A47G0025380000;Hook mountings therefor
A47G0025400000;Collapsible hangers
A47G0025420000;made of wire
A47G0025440000;Slidable hangers
A47G0025460000;made of wire
A47G0025480000;Hangers with clamps or the like, e.g. for trousers or skirts
A47G0025500000;Hooks on hangers for supporting trousers or skirts
A47G0025520000;made of wire
A47G0025540000;Dust- or moth-proof garment bags, e.g. with suit hangers
A47G0025560000;Devices for inserting clothes
A47G0025580000;Moth-proof bags with provisions for pesticides or pest repellants
A47G0025600000;Hangers having provision for perfumes or for pesticides or pest repellants, e.g. for storing in moth-proof bags
A47G0025620000;Trouser or skirt stretchers or tensioners of the hanger type (with application of heat or steam D06F)
A47G0025640000;made of wire
A47G0025660000;Trouser-stretchers with creasing or expanding devices (with application of heat or steam D06F)
A47G0025680000;stretching in longitudinal direction
A47G0025700000;made of wire
A47G0025720000;Garment-pressing devices (hot pressing apparatus or machines D06F)
A47G0025740000;Necktie holders
A47G0025760000;Necktie-stretching devices (with application of heat or steam D06F)
A47G0025780000;Necktie-pressing devices, e.g. combined with holding devices (hot-pressing apparatus D06F)
A47G0025800000;Devices for putting-on or removing boots or shoes, e.g. boot-hooks, boot-jacks (shoe buttoners A47G0025920000)
A47G0025820000;Shoe horns
A47G0025840000;Shoe benches
A47G0025860000;with boot-pulling devices
A47G0025880000;Devices for tucking ends of laces inside shoes or boots
A47G0025900000;Devices for domestic use for assisting in putting-on or pulling-off clothing, e.g. stockings or trousers
A47G0025920000;Shoe or collar buttoners. Bodkins. Glove hooks
A47G0027000000;Floor fabrics. Fastenings therefor (woven fabrics D03D. non-woven fabrics D04H)
A47G0027020000;Carpets. Stair runners. Bedside rugs. Foot mats (mat-like foot scrapers A47L0023220000)
A47G0027040000;Carpet fasteners. Carpet-expanding devices
A47G0027060000;Stair rods. Stair-rod fasteners (curtain rods A47H0001020000)
A47G0029000000;Supports, holders, or containers for household use, not provided for in groups  A47G0001000000-A47G0027000000.  or A47G0033000000. (for fastening kitchen utensils A47J0045000000. for drying towels A47K0010040000. stands, racks, or the like for airing beds, garments, or the like, clothes, drying devices D06F0057000000)
A47G0029020000;Wall boards (shelves A47B). Supporting brackets or clamps therefor
A47G0029060000;Paper baskets (refuse receptacles B65F0001000000)
A47G0029080000;Holders for articles of personal use in general, e.g. brushes
A47G0029087000;Devices for fastening household utensils, or the like, to tables, walls, or the like
A47G0029093000;Devices for securing receptacles to tables, or the like
A47G0029100000;Key holders. Key boards (key cases A45C0011320000)
A47G0029120000;Mail or newspaper receptacles, e.g. letter-boxes. Openings in doors or the like for delivering mail or newspapers (A47G0029140000 takes precedence.chutes for mail in buildings B65G0011040000)
A47G0029122000;Parts, details, or accessories, e.g. signalling devices, lamps, devices for leaving messages
A47G0029124000;Appliances to prevent unauthorised removal of contents
A47G0029126000;Lids for access slits
A47G0029140000;Deposit receptacles for food, e.g. breakfast, milk. Similar receptacles for large parcels with appliances for preventing unauthorised removal of the deposited articles
A47G0029160000;Combinations with letter-boxes
A47G0029180000;Clamping devices for holding bottles near doors or windows (preventing unauthorised removal A47G0029240000)
A47G0029200000;with appliances for preventing unauthorised removal of the deposited articles
A47G0029220000;having rotatable or reciprocable parts
A47G0029240000;Clamping devices for holding bottles near doors or windows
A47G0029260000;freeing the bottle only on opening door or window
A47G0029280000;having a receptacle inside the house and a delivery pipe or the like passing through a door, wall, or the like, e.g. for delivering milk
A47G0029300000;Accessories, e.g. signalling devices, lamps, means for leaving messages
A47G0033000000;Religious or ritual equipment in dwelling or for general use
A47G0033020000;Altars. Religious shrines. Fonts for holy water. Crucifixes
A47G0033040000;Christmas trees (lighting devices therefor F21S. candle holders F21V0035000000)
A47G0033060000;Artificial Christmas trees
A47G0033080000;Christmas tree decorations
A47G0033100000;Fastening devices or clamps for Christmas tree decorations
A47G0033120000;Christmas tree stands
A47G0035000000;Other dwelling equipment
A47H;FURNISHINGS FOR WINDOWS OR DOORS (concerned with the functioning of the door or window E05. roller blinds E06B. special arrangements or measures in connection with doors or windows, e.g. for ventilation or sealing, E06B0007000000)
A47H0001000000;Curtains. Draperies
A47H0001000000;Curtain suspension devices
A47H0001020000;Curtain rods
A47H0001022000;extensible
A47H0001030000;pivotably mounted for rotation with doors or windows
A47H0001040000;Curtain rails
A47H0001060000;fixed
A47H0001080000;extensible
A47H0001100000;Means for mounting curtain rods or rails
A47H0001102000;for mounting curtain rods (A47H0001120000, A47H0001140000 take precedence)..
A47H0001104000;for mounting curtain rails (A47H0001120000, A47H0001140000 take precedence)..
A47H0001120000;Adjustable mountings
A47H0001122000;for curtain rods
A47H0001124000;for curtain rails
A47H0001130000;Brackets or adjustable mountings for both roller blinds and drawable curtains
A47H0001140000;Brackets for supporting rods or rails
A47H0001142000;for supporting rods
A47H0001144000;for supporting rails
A47H0001160000;Holders made of wire for curtain rods
A47H0001180000;Other curtain suspension devices, e.g. wire, cord
A47H0001190000;Devices for mounting the wire, cord, or the like
A47H0002000000;Pelmets or the like
A47H0002020000;extensible
A47H0003000000;Fastening, clamping, or guiding devices for the bands or cords of curtains or the like
A47H0003020000;Fastening, clamping, or guiding devices for bands or cords
A47H0003040000;Automatic cord clamps
A47H0003060000;Non-automatic cord clamps
A47H0003080000;Cord-tensioning devices for curtains with two cords
A47H0003100000;Cord guides
A47H0003120000;Belt strap holders. Belt strap rollers. Belt strap tensioning devices
A47H0005000000;Devices for drawing draperies, curtains, or the like
A47H0005020000;Devices for opening and closing curtains
A47H0005030000;Devices with guiding means and push or draw rods
A47H0005032000;Devices with guiding means and draw cords (cord pulleys A47H0011060000)
A47H0005040000;Devices with lazy-tongs
A47H0005060000;Devices with screw-threads on rods or spindles
A47H0005080000;Devices for drawing draperies attached to the doors or windows
A47H0005090000;Devices for swinging the curtains away from doors or windows
A47H0005140000;Apparatus for lowering curtains or the like
A47H0007000000;Devices for putting-up and removing curtain rods
A47H0007020000;Curtain rods, capable of being lowered
A47H0011000000;Curtain cord appurtenances
A47H0011020000;Engaging-pieces on curtain cords for operating curtains
A47H0011040000;End attachment clips, e.g. for tassels
A47H0011060000;Cord pulleys
A47H0013000000;Fastening curtains on curtain rods or rails
A47H0013010000;by clamps. by clamps attached to hooks or rings
A47H0013020000;by rings, e.g. with additional runners (A47H0013120000 takes precedence)..
A47H0013040000;by hooks, e.g. with additional runners (A47H0013120000 takes precedence.by hooks specially adapted to pleat belts A47H0013160000)
A47H0013060000;by pins, e.g. with additional runners (A47H0013120000 takes precedence)..
A47H0013100000;by rail rollers
A47H0013120000;by rail gliders
A47H0013140000;Means for forming pleats
A47H0013160000;Pleat belts. Hooks specially adapted for pleat belts
A47H0015000000;Runners or gliders for supporting curtains on rails or rods
A47H0015020000;Runners
A47H0015040000;Gliders
A47H0019000000;Rosettes for holding curtains. Festoon holders
A47H0021000000;Curtain shields
A47H0023000000;Curtains. Draperies (shower curtain arrangements A47K0003380000)
A47H0023010000;Bottom bars for stretching hanging curtains. Magnets, slide fasteners, or the like to improve closing of curtains
A47H0023020000;Shapes of curtains. Selection of particular materials for curtains
A47H0023040000;Shapes of curtains
A47H0023050000;of chain or chain mail. of free-hanging strips or lamellae
A47H0023060000;Systems consisting of two or more co-operating curtains with transparent or perforated parts behind each other
A47H0023080000;Selection of particular materials
A47H0023100000;the material being plastics or the like
A47H0023120000;the material being paper or cardboard
A47H0023140000;the material being woven textile with reinforcing bars, e.g. made of wood
A47H0027000000;Boxes, shelves, holders or similar supports for holding flowers (windows adapted to carry plants E06B0007280000)
A47H0099000000;Subject matter not provided for in other groups of this subclass
A47J;KITCHEN EQUIPMENT. COFFEE MILLS. SPICE MILLS. APPARATUS FOR MAKING BEVERAGES
A47J0009000000;Apparatus or utensils for shaping butter or the like (for use in dairies A01J0019000000, A01J0021000000)
A47J0017000000;Household peeling, stringing, or paring implements or machines (for foodstuffs in bulk A23N)
A47J0017020000;Hand devices for scraping or peeling vegetables or the like
A47J0017040000;Citrus fruit peelers
A47J0017060000;Devices for stringing beans
A47J0017080000;Asparagus-peelers
A47J0017100000;Vegetable or fruit grippers or holders for use while peeling
A47J0017140000;Machines for peeling
A47J0017160000;Peeling machines with rotary fruit-holding spindles and fixed or movable peeler blades
A47J0017180000;with scraping discs or rotors
A47J0017200000;with brushes
A47J0019000000;Household machines for straining foodstuffs. Household implements for mashing or straining foodstuffs (for foodstuffs in bulk A23N)
A47J0019020000;Citrus fruit squeezers. Other fruit juice extracting devices
A47J0019040000;Household implements for mashing potatoes or other foodstuffs
A47J0019060000;Juice presses for vegetables
A47J0021000000;Devices for removing stalks from fruit (machines A23N0015020000)
A47J0023000000;Devices for stoning fruit (machines for stoning fruit in bulk A23N0003000000, A23N0004000000)
A47J0025000000;Devices for coring fruit (machines for coring fruit in bulk A23N0003000000, A23N0004120000)
A47J0027000000;Cooking. Apparatus for making beverages
A47J0027000000;Cooking-vessels (A47J0029000000-A47J0033000000.  take precedence)..
A47J0027020000;with enlarged heating surfaces
A47J0027022000;with enlarged bottom
A47J0027024000;with liquid-heating tubes extending outside the vessel
A47J0027026000;with conduits through the vessel for circulating heating gases
A47J0027040000;for cooking food in steam. Devices for extracting fruit juice by means of steam
A47J0027050000;Tier steam-cookers, i.e. with steam-tight joints between cooking-vessels stacked while in use
A47J0027060000;Steam-heated kettles for domestic use
A47J0027080000;Pressure cookers. Lids or locking devices specially adapted therefor
A47J0027082000;with inserts for cooking different foods separately at the same time. Inserts therefor
A47J0027084000;with adjustable volume. Tier pressure-cookers
A47J0027086000;with built-in heating means (adaptations of automatic switches for the heating means A47J0027620000)
A47J0027088000;adapted to high-frequency heating
A47J0027090000;Safety devices
A47J0027092000;Devices for automatically releasing pressure before opening
A47J0027100000;Cooking-vessels with water-bath arrangements for domestic use
A47J0027120000;Multiple-unit cooking-vessels
A47J0027122000;with adaptation of shape to that of adjacent vessels for forming a unit, e.g. sector-shaped
A47J0027130000;Tier cooking-vessels
A47J0027140000;Cooking-vessels for use in hotels, restaurants, or canteens
A47J0027160000;heated by steam
A47J0027170000;with steam jacket
A47J0027180000;heated by water-bath
A47J0027200000;Ham-boilers
A47J0027210000;Water-boiling vessels, e.g. kettles
A47J0027212000;with signalling means, e.g. whistling kettles
A47J0027560000;Preventing boiling over, e.g. of milk (appliances for preventing or destroying foam in dairy apparatus for treating milk A01J0011020000)
A47J0027570000;Milk-boiling vessels with water or steam jackets, e.g. with signalling means
A47J0027580000;Cooking utensils with channels or covers collecting overflowing liquid
A47J0027600000;Funnel-like inserts. Grooved plates to be placed on the bottom of cooking utensils
A47J0027620000;by devices for automatically controlling the heat supply by switching off heaters or for automatically lifting the cooking-vessels
A47J0027640000;for automatically lifting the cooking-vessels
A47J0029000000;Egg-cookers
A47J0029020000;for eggs or poached eggs. Time-controlled cookers
A47J0029040000;Cookers for eggs with devices for automatically lifting the eggs from the boiling water
A47J0029060000;Grasping devices for eggs. Supporting devices for eggs during boiling
A47J0031000000;Apparatus for making beverages (household machines or implements for straining foodstuffs A47J0019000000. preparation of non-alcoholic beverages, e.g. by adding ingredients to fruit or vegetable juices, A23L0002000000. coffee or tea pots A47G0019140000. tea infusers A47G0019160000. brewing of beer C12C. preparation of wine or other alcoholic beverages C12G)
