A23L0001317000;Comminuted or emulsified meat products, including sausages. Reformed meat from comminuted meat products
A23L0001318000;Tenderised or flavoured meat pieces, e.g. obtained by injecting solutions. Macerating solutions
A23L0001320000;Egg products
A23L0001322000;Egg rolls
A23L0001325000;Food-from-the-sea products. Fish products. Fish meal. Fish-egg substitutes
A23L0001326000;Fish meal or powder. Granules, agglomerates or flakes
A23L0001327000;Fish extracts
A23L0001328000;Fish eggs, e.g. caviar. Fish-egg substitutes
A23L0001330000;Shell-fish
A23L0001333000;Molluscs
A23L0001337000;Edible seaweed
A23L0001360000;Food consisting mainly of nut meats or seeds
A23L0001380000;Peanut butter
A23L0001390000;Soups. Sauces (A23L0001238000, A23L0001240000 take precedence)..
A23L0001400000;Soup concentrates, e.g. powders, cakes
A23L0001480000;Food compositions or treatment thereof not covered by the preceding subgroups
A23L0002000000;Non-alcoholic beverages. Dry compositions or concentrates therefor. Their preparation (soup concentrates A23L0001400000. preparation of non-alcoholic beverages by removal of alcohol C12H0003000000)
A23L0002020000;containing fruit or vegetable juices
A23L0002040000;Extraction of juices (machines or apparatus for extracting juice A23N0001000000, A47J0019000000)
A23L0002060000;from citrus fruits
A23L0002080000;Concentrating or drying of juices
A23L0002100000;by heating or contact with dry gases
A23L0002120000;by freezing
A23L0002140000;and sublimation
A23L0002380000;Other non-alcoholic beverages
A23L0002385000;Concentrates of non-alcoholic beverages
A23L0002390000;Dry compositions
A23L0002395000;in a particular shape or form
A23L0002400000;Effervescence-generating compositions
A23L0002420000;Preservation of non-alcoholic beverages
A23L0002440000;by adding preservatives
A23L0002460000;by heating
A23L0002480000;by irradiation or electric treatment
A23L0002500000;by irradiation or electric treatment without heating
A23L0002520000;Adding ingredients (adding preservatives A23L0002440000)
A23L0002540000;Mixing with gases
A23L0002560000;Flavouring or bittering agents (sweeteners A23L0002600000)
A23L0002580000;Colouring agents
A23L0002600000;Sweeteners
A23L0002620000;Clouding agents. Agents to improve the cloud-stability
A23L0002640000;Re-adding volatile aromatic ingredients
A23L0002660000;Proteins
A23L0002680000;Acidifying substances
A23L0002700000;Clarifying or fining of non-alcoholic beverages. Removing unwanted matter
A23L0002720000;by filtration
A23L0002740000;using membranes, e.g. osmosis, ultrafiltration
A23L0002760000;by removal of gases
A23L0002780000;by ion-exchange
A23L0002800000;by adsorption
A23L0002820000;by flocculation
A23L0002840000;using micro-organisms or biological material, e.g. enzymes
A23L0003000000;Preservation of foods or foodstuffs, in general, e.g. pasteurising, sterilising, specially adapted for foods or foodstuffs (preserving foods or foodstuffs in association with packaging B65B0055000000)
A23L0003005000;by heating using irradiation or electric treatment (drying or kilning A23L0003400000)
A23L0003010000;using micro-waves or dielectric heating
A23L0003015000;by treatment with pressure variation, shock, acceleration or shear stress
A23L0003020000;by heating materials in packages which are progressively transported, continuously or stepwise, through the apparatus (A23L0003005000 takes precedence)..
A23L0003040000;with packages on endless chain or band conveyors
A23L0003060000;with packages transported along a helical path
A23L0003080000;with packages on a revolving platform
A23L0003100000;by heating materials in packages which are not progressively transported through the apparatus (A23L0003005000 takes precedence)..
A23L0003120000;with packages in intercommunicating chambers through which the heating medium is circulated
A23L0003140000;with packages moving on the spot
A23L0003160000;by heating loose unpacked materials (A23L0003005000 takes precedence)..
A23L0003180000;while they are progressively transported through the apparatus
A23L0003200000;with transport along plates
A23L0003220000;with transport through tubes
A23L0003240000;with the materials in spray form
A23L0003260000;by irradiation without heating
A23L0003280000;with ultra-violet light
A23L0003300000;by treatment with ultrasonic waves
A23L0003320000;by treatment with electric currents without heating effect
A23L0003340000;by treatment with chemicals
A23L0003340900;in the form of gases, e.g. fumigation. Compositions or apparatus therefor
A23L0003341800;in a controlled atmosphere, e.g. partial vacuum, comprising only CO. 2, N2, O2 or H2O
A23L0003342700;in which an absorbent is placed or used (packages for foodstuffs with provision for absorbing fluids B65D0081260000)
A23L0003343600;Oxygen absorbent
A23L0003344500;in a controlled atmosphere comprising other gases in addition to CO. 2, N2, O2 or H2O
A23L0003345400;in the form of liquids or solids
A23L0003346300;Organic compounds. Micro-organisms. Enzymes
A23L0003347200;Compounds of undetermined constitution obtained from animals or plants
A23L0003348100;Organic compounds containing oxygen
A23L0003349000;with singly-bound oxygen
A23L0003349900;with doubly-bound oxygen
A23L0003350800;containing carboxyl groups
A23L0003351700;Carboxylic acid esters
A23L0003352600;Organic compounds containing nitrogen
A23L0003353500;Organic compounds containing sulfur
A23L0003354400;Organic compounds containing hetero rings
A23L0003355300;Organic compounds containing phosphorus
A23L0003356200;Sugars. Derivatives thereof
A23L0003357100;Micro-organisms. Enzymes
A23L0003358000;Inorganic compounds
A23L0003358900;Apparatus for preserving using liquids
A23L0003359800;Apparatus for preserving using solids
A23L0003360000;Freezing. Subsequent thawing. Cooling
A23L0003365000;Thawing subsequent to freezing
A23L0003370000;with addition of chemicals
A23L0003375000;with direct contact between the food and the chemical, e.g. liquid N. 2, at cryogenic temperature
A23L0003400000;by drying or kilning. Subsequent reconstitution
A23L0003420000;with addition of chemicals before or during drying
A23L0003440000;Freeze-drying
A23L0003460000;Spray-drying
A23L0003480000;Thin layer-, drum- or roller-drying
A23L0003500000;Fluidised-bed drying
A23L0003520000;Foam-drying
A23L0003540000;using irradiation or electric treatment, e.g. ultrasonic waves
A23N;MACHINES OR APPARATUS FOR TREATING HARVESTED FRUIT, VEGETABLES, OR FLOWER BULBS IN BULK, NOT OTHERWISE PROVIDED FOR. PEELING VEGETABLES OR FRUIT IN BULK. APPARATUS FOR PREPARING ANIMAL FEEDING-STUFFS (machines for cutting straw or fodder A01F0029000000. disintegrating, e.g. shredding, B02C. severing, e.g. cutting, splitting, slicing, B26B, B26D)
A23N0001000000;Machines or apparatus for extracting juice (preparation of non-alcoholic beverages, e.g. by adding ingredients to fruit or vegetable juices, A23L0002000000. apparatus for making beverages A47J0031000000. extracting presses B30B)
A23N0001020000;combined with disintegrating or cutting
A23N0003000000;Machines for coring or stoning fruit, characterised by their feeding device (A23N0004000000 takes precedence)..
A23N0003020000;with feeder-drums
A23N0003040000;with endless feeder-belts
A23N0003060000;with feeder-tables
A23N0004000000;Machines for stoning fruit or removing seed-containing sections from fruit, characterised by their stoning or removing device (for peeling fruit and removing seed-containing sections A23N0007080000. domestic devices for stoning fruit A47J0023000000, for coring fruit A47J0025000000)
A23N0004020000;for stoning fruit
A23N0004040000;for peaches, plums, apricots or the like
A23N0004060000;for cherries or the like (A23N0004040000 takes precedence)..
A23N0004080000;for dates, olives or the like oblong fruits
A23N0004100000;for fruit with very small pips e.g. raisins
A23N0004120000;for coring fruit
A23N0004140000;for apples, pears or the like
A23N0004160000;for tomatoes or the like
A23N0004180000;for citrus fruits
A23N0004200000;for pineapples
A23N0004220000;for both splitting and stoning
A23N0004240000;for removing seed-containing sections from cut fruit
A23N0005000000;Machines for hulling, husking, or cracking nuts
A23N0005010000;for peanuts
A23N0005030000;for coconuts (A23N0005080000 takes precedence)..
A23N0005080000;for removing fleshy or fibrous hulls of nuts (for peanuts A23N0005010000)
A23N0007000000;Peeling vegetables or fruit (devices for skinning onions A23N0015080000. peeling machines of the household type A47J0017000000)
A23N0007010000;using chemical substances, e.g. lye
A23N0007020000;Peeling potatoes, apples or similarly shaped vegetables or fruit (A23N0007010000 takes precedence)..
A23N0007040000;Peeling asparagus (A23N0007010000 takes precedence)..
A23N0007080000;for peeling fruit and removing seed-containing sections
A23N0007100000;Driving mechanisms
A23N0011000000;Removing pith from stems
A23N0012000000;Machines for cleaning, blanching, drying or roasting fruits or vegetables, e.g. coffee, cocoa, nuts (methods for treating, e.g. roasting, coffee or cocoa A23F, A23G. cleaning, e.g. washing, or drying grain B02B0001000000. separating solids from solids for cleaning B07B. cleaning in general B08B. heating devices per se, see the relevant classes, e.g. F24. drying machines in general F26B)
A23N0012020000;for washing or blanching (A23N0012060000 takes precedence.blanching methods A23B0007060000)
A23N0012040000;for blanching
A23N0012060000;for washing or blanching, combined with subsequent drying
A23N0012080000;for drying or roasting (A23N0012060000 takes precedence)..
A23N0012100000;Rotary roasters
A23N0012120000;Auxiliary devices for roasting machines
A23N0015000000;Machines or apparatus for other treatment of fruits or vegetables for human purposes. Machines or apparatus for topping or skinning flower bulbs
A23N0015010000;for stripping brussels' sprouts from stalks
A23N0015020000;for stemming, piercing or stripping fruit. Removing sprouts of potatoes
A23N0015040000;Devices for topping fruit or vegetables (topping onions A23N0015080000)
A23N0015060000;Devices for other treatment of fruit, e.g. marking, maturing, polishing
A23N0015080000;Devices for topping or skinning onions or flower bulbs
A23N0015100000;for shelling peas or beans
A23N0015120000;for snipping or stringing beans
A23N0017000000;Apparatus specially adapted for preparing animal feeding-stuffs
A23N0017020000;Fodder mashers (household implements for mashing potatoes or other foodstuffs A47J0019040000)
A23P;SHAPING OR WORKING OF FOODSTUFFS, NOT FULLY COVERED BY A SINGLE OTHER SUBCLASS (shaping substances in a plastic state in general B29C)
A23P0001000000;Shaping or working of foodstuffs
A23P0001020000;Agglomerating. Granulating. Tabletting
A23P0001040000;Encapsulation of particles, e.g. foodstuff additives (flavouring agents A23L0001220000)
A23P0001060000;Making free-flowing or instant powder (A23P0001020000, A23P0001040000 take precedence)..
A23P0001080000;Coating of foodstuffs. Coatings therefor. Making of laminated, multilayered or stuffed foodstuffs
A23P0001100000;Other shaping methods, e.g. moulding
A23P0001120000;Extruding
A23P0001140000;Puffing or expanding (A23L0001164000, A23L0001180000, A23L0001217000 take precedence)..
A23P0001160000;Foaming or whipping (cream substitutes A23L0001190000)
A24;TOBACCO. CIGARS. CIGARETTES. SMOKERS' REQUISITES
A24B;MANUFACTURE OR PREPARATION OF TOBACCO FOR SMOKING OR CHEWING. TOBACCO. SNUFF
A24B0001000000;Preparation of tobacco on the plantation (harvesters for tobacco A01D0045160000)
A24B0001020000;Arrangements in barns for preparatory treatment of the tobacco, e.g. with devices for drying
A24B0001040000;Sifting, sorting, cleaning or removing impurities from tobacco (purifying by sifting or sorting in general B07B)
A24B0001060000;Stringing tobacco leaves
A24B0001080000;Suspending devices for tobacco leaves
A24B0001100000;Packing or pressing tobacco
A24B0003000000;Preparing tobacco in the factory
A24B0003020000;Humidifying packed raw tobacco (containers for packaging contents in moist condition B65D0081220000)
A24B0003040000;Humidifying or drying tobacco bunches or cut tobacco (A24B0003120000 takes precedence)..
A24B0003060000;Loosening tobacco leaves or cut tobacco (A24B0003070000 takes precedence)..
A24B0003070000;Cutting or removing tie leaves. Cutting-off stem butts
A24B0003080000;Blending tobacco
A24B0003100000;Roasting or cooling tobacco
A24B0003120000;Steaming, curing, or flavouring tobacco
A24B0003140000;Forming reconstituted tobacco products, e.g. wrapper materials, sheets, imitation leaves, rods, cakes. Forms of such products (delustering A24C0001400000. tobacco or cigarette paper D21H)
A24B0003160000;Classifying or aligning leaves
A24B0003180000;Other treatment of leaves, e.g. puffing, crimpling, cleaning
A24B0005000000;Stripping tobacco. Treatment of stems or ribs
A24B0005020000;by plucking out the stem
A24B0005040000;by cutting out the stem
A24B0005060000;by stripping leaf-parts from the stem
A24B0005080000;by cutting-off, shaving off, pressing flat the thick parts of stems or ribs
A24B0005100000;by crushing the leaves with subsequent separating
A24B0005120000;Auxiliary devices for stripping
A24B0005140000;Flattening machines for leaves or stems
A24B0005160000;Other treatment of stems or ribs, e.g. bending, chopping, incising (humidifying A24B0003040000)
A24B0007000000;Cutting tobacco (hand-cutting tools B26B. slicing in general B26D0001000000, B26D0003000000)
A24B0007020000;by machines with reciprocating knives
A24B0007040000;by machines with revolving knives
A24B0007060000;with two co-operating sets of knife discs
A24B0007080000;with several knives which act one after the other
A24B0007100000;with cutter axes parallel to the feeding direction
A24B0007120000;with cutter axes transverse to the feeding direction
A24B0007140000;Feeding or regulating devices for tobacco-cutting apparatus
A24B0009000000;Control of the moisture content of tobacco products, e.g. cigars, cigarettes, pipe tobacco (devices for use by the smoker for controlling the moisture content of tobacco products A24F0025000000)
A24B0011000000;Tobacco-twisting machines
A24B0013000000;Tobacco for pipes, for cigars, e.g. cigar inserts, or for cigarettes. Chewing tobacco. Snuff (mechanical treatment A24B0003000000-A24B0011000000. reconstituted tobacco products A24B0003140000. chemical features or treatment of tobacco A24B0015000000)
A24B0013020000;Flakes or shreds of tobacco
A24B0015000000;Chemical features or treatment of tobacco. Tobacco substitutes (A24B0003000000 takes precedence)..
A24B0015100000;Chemical features of tobacco products or tobacco substitutes
A24B0015120000;of reconstituted tobacco
A24B0015140000;made of tobacco and a binding agent not derived from tobacco
A24B0015160000;of tobacco substitutes
A24B0015180000;Treatment of tobacco products or tobacco substitutes
A24B0015200000;Biochemical treatment
A24B0015220000;by application of electric or wave energy or particle radiation
A24B0015240000;by extraction. Tobacco extracts
A24B0015260000;Use of organic solvents for extraction
A24B0015280000;by chemical substances
A24B0015300000;by organic substances
A24B0015320000;by acyclic compounds
A24B0015340000;containing a carbocyclic ring other than a six-membered aromatic ring
A24B0015360000;containing a heterocyclic ring
A24B0015380000;having only nitrogen as hetero-atoms
A24B0015400000;having only oxygen or sulfur as hetero-atoms
A24B0015420000;by organic and inorganic substances
A24C;MACHINES FOR MAKING CIGARS OR CIGARETTES
A24C0001000000;Making cigars
A24C0001000000;Elements of cigar manufacture (combinations of two or more elements of cigar manufacture A24C0003000000. attaching or incorporating filters or mouthpieces A24C0005470000, A24C0005520000. cutting machines in general B26D)
A24C0001020000;Tobacco-feeding devices with or without means for dividing the tobacco into measured quantities
A24C0001040000;Devices for cutting cigar binders or wrappers
A24C0001080000;Making tobacco bunches
A24C0001100000;Bunch-making machines with aprons and tables for wrapping
A24C0001120000;Bunch-making machines with wrapping rollers
A24C0001140000;Bunch-making machines with grippers
A24C0001160000;Treating bunches
A24C0001180000;Moulds or presses for cigar bunches
A24C0001200000;Rotating moulds for cigar bunches
A24C0001220000;Rolling formed bunches
A24C0001240000;Cutting bunches to length
A24C0001260000;Applying the wrapper
A24C0001280000;Wrapper transferring mechanisms
A24C0001300000;Devices for applying the wrapper to the bunch
A24C0001320000;Devices for forming the tips of cigars (filter tips, mouthpieces A24D0003000000)
A24C0001340000;Adhesive-applying means
A24C0001360000;Cutting wrapped bunches to length
A24C0001380000;Final treatment of cigars, e.g. sorting (drying cigars A24B0009000000)
A24C0001400000;Delustering or powdering cigars
A24C0001420000;Marking, printing, or decorating cigars
A24C0001440000;Bundling and pressing devices for cigars
A24C0003000000;Complete manufacture of cigars. Combinations of two or more elements of cigar manufacture
A24C0005000000;Making cigarettes. Making tipping materials for, or attaching filters or mouthpieces to, cigars or cigarettes
A24C0005020000;Cigarette-filling machines
A24C0005040000;with continuous rod (A24C0005140000 takes precedence)..
A24C0005060000;with pressing-chamber
A24C0005080000;Machines with aprons and tables for wrapping
A24C0005100000;Machines with wrapping rollers
A24C0005120000;Cutting the ends of filled and rolled cigarettes
A24C0005140000;Machines of the continuous-rod type (tobacco feeding devices A24C0005390000)
A24C0005180000;Forming the rod
A24C0005200000;Reels. Supports for bobbins. Other accessories
A24C0005220000;Creasing the paper seam
A24C0005240000;Pasting the seam
A24C0005260000;Drying the seam
A24C0005280000;Cutting-off the tobacco rod
A24C0005300000;Machines combined with devices for grinding the knives
A24C0005310000;with special arrangements coming into operation during starting, slowing-down, or breakdown of the machine, e.g. for diverting or breaking the continuous rod
A24C0005320000;Separating, ordering, counting, or examining cigarettes (in relation to packaging B65B0019000000). Regulating the feeding of tobacco according to rod or cigarette condition (investigating or analysing materials by determining their chemical or physical properties G01N. controlling in general G05)
A24C0005330000;Catching or ordering devices
A24C0005340000;Examining cigarettes or the rod, e.g. for regulating the feeding of tobacco. Removing defective cigarettes
A24C0005343000;by mechanical means, e.g. feelers
A24C0005345000;Removing defective cigarettes (A24C0005310000 takes precedence)..
A24C0005350000;Adaptations of conveying apparatus for transporting cigarettes from making machine to packaging machine
A24C0005352000;using containers, i.e. boats
A24C0005354000;Filling the boats at the making machine
A24C0005356000;Emptying the boats into the hopper of the packaging machine (hopper construction B65B0019040000)
A24C0005358000;Boat constructions
A24C0005360000;Removing papers or other parts from defective cigarettes
A24C0005380000;Machines combined with printing devices
A24C0005390000;Tobacco feeding devices (regulating feed according to rod or cigarette condition A24C0005340000)
A24C0005400000;Hand-driven apparatus for making cigarettes
A24C0005420000;Pocket cigarette-fillers
A24C0005440000;Pocket cigarette-rollers
A24C0005460000;Making paper tubes for cigarettes (making paper tubes in general B31C)
A24C0005470000;Attaching filters or mouthpieces to cigars or cigarettes, e.g. inserting filters into cigarettes or their mouthpieces (A24C0005520000 takes precedence.filters, their manufacture, mouthpieces A24D0003000000)
A24C0005520000;Incorporating filters or mouthpieces into a cigarette rod or a tobacco rod (filters, their manufacture, mouthpieces A24D0003000000)
A24C0005540000;Folding the ends of cigarette paper tubes after filling them with tobacco
A24C0005560000;Making tipping materials, e.g. sheet cork for mouthpieces of cigars or cigarettes, by mechanical means (chemical part of making tipping material C08. wrapping papers for cigarettes D21H)
A24C0005580000;Applying the tipping materials
A24C0005600000;Final treatment of cigarettes, e.g. marking, printing, branding, decorating
A24D;CIGARS. CIGARETTES. TOBACCO SMOKE FILTERS. MOUTHPIECES FOR CIGARS OR CIGARETTES. MANUFACTURE OF TOBACCO SMOKE FILTERS OR MOUTHPIECES
A24D0001000000;Cigars. Cigarettes
A24D0001020000;with special covers
A24D0001040000;with mouthpieces or filter-tips (mouthpieces, filter-tips per seA24D0003000000)
A24D0001080000;with lighting means (pyrophoric compositions C06C0015000000. lighters per seF23Q)
A24D0001100000;with extinguishers
A24D0001120000;with ash-retaining attachments, holders, or other equipment
A24D0001140000;Tobacco cartridges for pipes
A24D0001160000;Bands for cigars or cigarettes (machines for applying bands B65C)
A24D0001180000;Selection of materials, other than tobacco, suitable for smoking
A24D0003000000;Tobacco smoke filters, e.g. filter-tips, filtering inserts (filters in general B01D). Mouthpieces for cigars or cigarettes (for pipes, for cigar or cigarette holders A24F0007000000)
A24D0003020000;Manufacture of tobacco smoke filters (manufacture of paper or cellulosic materials for filters D21)
A24D0003040000;Tobacco smoke filters characterised by their shape or structure
A24D0003060000;Use of materials for tobacco smoke filters
A24D0003080000;of organic materials as carrier or major constituent (of ion exchange materials A24D0003120000)
A24D0003100000;of cellulose or cellulose derivatives
A24D0003120000;of ion exchange materials
A24D0003140000;of organic materials as additive (of ion exchange materials A24D0003120000)
A24D0003160000;of inorganic materials
A24D0003180000;Mouthpieces for cigars or cigarettes. Manufacture thereof (A24D0003020000 takes precedence.making tipping materials for, or attaching them to mouthpieces of, cigars or cigarettes A24C0005560000. producing cigar or cigarette holders from plastics or from substances in a plastic state B29D0023140000. manufacture from metal, see the relevant subclasses of Section B).
A24F;SMOKERS' REQUISITES. MATCH BOXES (lighters F23Q)
A24F0001000000;Tobacco pipes
A24F0001000000;Tobacco pipes (bee-keepers' pipes A01K0055000000)
A24F0001020000;with arrangements for cleaning or cooling the smoke (hookahs A24F0001300000)
A24F0001040000;with smoke chamber or slobber traps
A24F0001060000;inside the pipe
A24F0001080000;inside the stem
A24F0001100000;inside the bowl
A24F0001120000;outside the pipe
A24F0001140000;with liquid-container
A24F0001160000;with zigzag or like passages for the smoke
A24F0001180000;with non-absorbent linings
A24F0001200000;with absorbent linings
A24F0001220000;with arrangements for cooling by air, e.g. pipes with double walls
A24F0001240000;for burning the tobacco from below
A24F0001260000;with filling devices
A24F0001280000;Tubular pipes, e.g. in the form of cigars
A24F0001300000;Hookahs
A24F0001320000;Selection of materials for pipes
A24F0003000000;Tobacco pipes combined with other objects (smoking appliances on walking sticks or canes A45B0003160000)
A24F0003020000;with cleaning appliances
A24F0005000000;Component parts or accessories for pipes. Mouthpieces
A24F0005000000;Bowls for pipes
A24F0005020000;with arrangements for keeping upright, when put aside
A24F0005040000;with holes for admitting air
A24F0005060000;with insets of clay or the like
A24F0005080000;with grates, sieves, or the like
A24F0005100000;Bowl-covers, attached and removable
A24F0005120000;with attached stoppers
A24F0005140000;with wind screens
A24F0007000000;Mouthpieces for pipes. Mouthpieces for cigar or cigarette holders
A24F0007020000;with detachable connecting members
A24F0007040000;with smoke filters (filters therefor A24D0003000000)
A24F0009000000;Accessories for smokers' pipes
A24F0009020000;Tobacco stoppers, i.e. devices for tamping tobacco down into the pipe (combined with tobacco cases A24F0023040000)
A24F0009040000;Cleaning devices for pipes (combined with pipes A24F0003020000)
A24F0009060000;for stems, e.g. brushes, needles, strings
A24F0009080000;Cleaning-sets
A24F0009100000;for bowls, e.g. scrapers, bowl-cleaners with cutting-teeth
A24F0009120000;Devices for cleaning tobacco pipes by steam, air, or water
A24F0009140000;Stands or supports for tobacco pipes
A24F0009160000;Protective coverings or cases for pipes or parts thereof
A24F0011000000;Seasoning of tobacco pipes
A24F0013000000;Appliances for smoking cigars or cigarettes
A24F0013020000;Cigar or cigarette holders (mouthpieces A24F0007000000)
A24F0013040000;with arrangements for cleaning or cooling the smoke (hookahs A24F0001300000)
A24F0013060000;with smoke filters (filters therefor A24D0003000000)
A24F0013080000;with special devices, e.g. spikes or grippers, for holding the cigars or cigarettes
A24F0013100000;with end-ejectors
A24F0013120000;combined with other objects, e.g. writing utensils (combined with walking or umbrella sticks A45B0003160000)
A24F0013140000;Protecting cases
A24F0013160000;Safety sleeves for cigars or cigarettes preventing damage by glowing ash
A24F0013180000;Extinguishers for cigars or cigarettes
A24F0013200000;Means for cutting-off the glowing ash
A24F0013220000;Supports for holding cigars or cigarettes while smoking
A24F0013240000;Cigar cutters, slitters, or perforators, e.g. combined with lighters (combined with hand-shears or scissors B26B0013220000)
A24F0013260000;formed as pocket devices
A24F0013280000;Devices for blowing through cigars
A24F0013300000;Arrangements for producing smoke images or rings (smoke toys A63H0033280000)
A24F0015000000;Cigar or cigarette receptacles or boxes (adaptations for use in vehicles B60N0003120000. packages B65D)
A24F0015020000;for domestic use
A24F0015040000;with appliances for releasing a single cigar or cigarette
